{
  "name": "fuzzy-search",
  "version": "1.1.1",
  "description": "MCP server exposing fuzzy content/file/document search tools built on ripgrep + fzf (plus ripgrep-all and PyMuPDF for PDFs). Use when searching code, files, or documents with fuzzy filtering, or extracting/inspecting PDF pages and outlines.",
  "author": {
    "name": "Alberto Leal"
  },
  "license": "MIT",
  "keywords": [
    "mcp",
    "fuzzy-search",
    "ripgrep",
    "fzf",
    "ripgrep-all",
    "pdf",
    "search",
    "content-search"
  ]
}
