{
  "name": "sequential-thinking",
  "version": "1.0.4",
  "description": "MCP server exposing a single `sequentialthinking` tool for dynamic, reflective, step-by-step problem-solving. Use when a task needs structured reasoning, planning, hypothesis generation, branching to explore alternatives, or revising earlier steps while keeping a running chain of thoughts.",
  "author": {
    "name": "Alberto Leal"
  },
  "license": "MIT",
  "keywords": [
    "mcp",
    "sequential-thinking",
    "reasoning",
    "planning",
    "problem-solving",
    "reflection",
    "chain-of-thought"
  ]
}
